<?xml version="1.0" encoding="UTF-8" ?>

<power_tools xmlns:xsi = "http://www.w3.org/2001/XMLSchema-instance"
             xsi:noNamespaceSchemaLocation = "electric_tools.xsd">

    <model>
        <name>Drill</name>
        <brand>Makita</brand>
        <origin>China</origin>
        <handy>Double-handed</handy>
        <technical_data>
            <vitality>Low</vitality>
            <energy consumption = "230">Volt</energy>
            <power requirementn = "550">Watt</power>
            <turnover frequency = "0-4200">RPM</turnover>
            <rotation torgue = "65">Nm</rotation>
            <acoustic power = "98">dB</acoustic>
        </technical_data>
        <material>PVC and steel</material>
    </model>

    <model>
        <name>Screw gun</name>
        <brand>Bosch</brand>
        <origin>Poland</origin>
        <handy>One-handed</handy>
        <technical_data>
            <vitality>low</vitality>
            <energy Li-ion = "3">Ah</energy>
            <power requirementn = "18">Volt</power>
            <turnover frequency = "0-1700">RPM</turnover>
            <rotation torgue = "22">Nm</rotation>
            <acoustic power = "45" >dB</acoustic>
        </technical_data>
        <material>PVC</material>
    </model>

</power_tools>